
- Алло, це радіо Херсон? - Так! - Можна поставити пісню для орків? - Яку? - На маленьком плоту, Ю. Лози.

Сидять у потязі два українці і, раптом, помічають москаля: - Добрий день, синку! - Здрастє. - А скільки тобі років? - В октябре будет 20... - Ой, не буде, хлопче, ой, не буде!

- Вільна каса! - Даблчіз меню, будь ласка. - Бажаєте придбати відірвану долоньку російського солдата? Усі гроші - на ЗСУ. - Давайте дві.

Раніше росію зрівнювали з Америкою, а зараз росію можна зрівняти тільки з землею.

Йдуть по пустелі українець з цілим мішком сала та москаль з мішком золота. Вже довго йдуть, втомились, їсти хочеться. - Слухай, українцю, а давай уявімо, що ми на базарі - ти продаєш сало, а я в тебе купую. - Ну давай! Один кілограм за мішок золота. - Ти що, збожеволів? За якийсь один кілограм сала цілий мішок золота! - А ти, москалику, піди по базарі пройдись - поторгуйся!

У Львові на футболі фани заводять: Хто не скаче, той москаль! Підривається пів стадіону. Позаду сім’я (тато, мама, дитина років 5). Дитина питає: - Пап-пап, а что они кричат? - Прыгай давай...



Виступає представник України в ООН: - Коли князь Русі Олег пішов скупатися в річці, москалі вкрали його меч, який він залишив на березі. Представник московії: - А при чому тут москалі? Москалів тоді взагалі ще не було! - Саме про це я й хотів сказати.

Заночували три москаля біля багаття, попили горілки та вирішили зіграти у російську рулетку. Перший заряджає один патрон, натискає на курок та падає. Другий заряджає патрон, тисне на курок і падає. Третій заряджає патрон і думає: - А хіба Макаровим грають у рулетку?

Якщо ви почуваєтесь непотрібними, згадайте, що хтось в росії вчиться на факультеті міжнародних відносин.

За найсерйозніші провали в російські армії солдата закривають на ніч на складі з боєприпасами.

Як би не було важко - не кисніть. Могло бути й гірше. Ми могли народитись москалями. Так що перехрестились та живемо далі.

Насправді Притула купив супутник, щоб зняти шоу для русні: Хто знизу.

До магазину заходить чоловік та й питає: - Товаріщ, у вас єсть лєзвия для брітви? - Ні, нема. Покупець пішов, касирка здивовано запитує продавця: - А чому ти йому сказав, що немає? Вони ж ось. - Він мене товаріщєм обізвав. Хай серпом бриється.



Русофобія - це така фобія, коли ти не боїшся, а ненавидиш.

Хай сьогодні у ночі рознесе русню на друзки і бурятів на куски, а кадирівців в гівно і хай здохне ще хуйло.

В усіх нормальних країнах є перша леді, а у росії - лавров...

- Пам’ятаєш серіал Кадети? - На жаль, так. - Знаєш як би він називався у 2022? - Як? - Пакети.

Музей козацької слави. Екскурсовод: - Ось шашка Сагайдачного, ось шаровари Петлюри, ось гетьманська булава... а це - вбитий москаль... а щоб він не засмердівся, ми їх три рази на день міняємо!

росія: у нас вторая армия в мире! Та сама росія: Іран, дайте нам дрони, бо капєц відгрібаємо від ЗСУ!

Цікаво, а росіяни вигадують які-небудь нагороди, пов’язані з цією війною? Там, орден: За героическое блуждание вокруг Харкова. Або медаль: Выжившему на острове Змеиный...



Батько копає яму. П’ятирічний синочок підходить і каже: - Тату, а що це ти робиш? - Що роблю? Яму копаю, буду буряк на зиму заготовляти. Хлопчик трохи помовчав і каже: - Тату, а давай туди москаля кинемо. Батько, витираючи сльозу: - Таке мале, а вже господар!

- Хто почне сьогоднішнє засідання? - Можна я? - Ні, ви знову про москалів будете. - Так я про екологію. - Ну тоді добре. - Любі друзі. Що робиться з нашою екологією? Річки міліють, дерева всихають. Скоро ніде буде втопити чи повісити клятого москаля

Мені здається дуже проблематичний той факт, що росіяни замало грають у російську рулетку. Згодні?

Чим відрізняється холодильник від сина-окупанта? Холодильник прослужить довше.

Оголошення. Продам червону цеглу, в необмеженій кількості... Звертатись за адресою: москва, кремль. Самовивіз.

Вже зовсім скоро новий туроператор HIMARS-TRAVEL запустить тури в Крим. HimarsTravel - з нами побачите Крим заново!

Якщо взяти 2000 русні не в кільце, а в квадрат то це буде 4 мільйони і перемога за нами!



Львів. В салон автобуса заходить вуйко з кулеметом: - Шановні добродії, а чи не підкажете ви мені котра година? Усі сидять, мовчать. Тут чорношкіра людина схоплюється з місця: - Сімнадцять годин, п’ятнадцять хвилин дядьку! - Та сиди, синку, сам бачу, що не москаль!

- Дідусю! Дідусю! - Що внучку? - Чорти в хату лізуть! - Пусте, головне що не москалі.

Російська мама взяла кредит на 7 мільйонів рублів в заставу мертвого сина, який на момент заключення кредитного договору був ще живий... Вона вірить в ЗСУ!

- Скільки коштуватиме бензопила, щоб пиляти москаля? - Це вам обійдеться в 1000$. - Зачекайте, це не правильно все... Давайте ще раз! - Означає обійдеться... - О, правильно, обійдеться, пилятиму звичайною пилою...

Я вважаю ми дожили до того моменту, коли екологи мають розробляти план по знищенню русні аби всім у світі стало краще. І чистіше...

Всесвіт постійно розширюється, бо всі хочуть бути подалі від росії...

Міняю знання російської мови на 0,5 живчика.



Судячи по кількості охорони в патріарха кирила - в Бога він не вірить...

- А що Ви одягнете в день смерті путіна?!? - Сподіваюсь ще шорти...

Якщо воно виглядає, як людина, ходить, як людина, і розмовляє, як людина - не факт, що воно насправді людина: це може бути галіма русня.

В дитинстві завжди хотіла дізнатися, що було в російській казці далі, після того, як Іван-дурак став царем. Дізналася...

Вночі Україна не могла бомбити Бєлгород. У нас комендантська година. Ми спимо.

Кацап повернувшись з війни сказав своєму псу: Шарик, к ногє... І він побіг в Україну...

В якості жесту доброї волі росія прийняла рішення про свій розпад.



В якості жесту доброї волі 36000 російських солдат лягли в українську землю.

Що сказала чічеріна на концерті перед уцілілими руснявими солдатами? - Я не віжу ваших рук!

Орки прочитавши: Жінка сварила чоловіка - знову звинувачують нас в людожерстві...

Матір російського солдата, яка працює на касі в супермаркеті, завжди знає, що - Пакет нужен.

Що сказав харківський художник, який вбив усіх полонених росіян, окрім одного? - Остался последний штрих.

Навіщо проводити досліди на тваринах? Якщо є москалі?

Львів. Поліція. Допитують росіянина: - Фамілія? - Чья? - Ім’я? - Чьйо? - Так, Чья Чьйо, китаєць, чи що?



Кажуть, що після знищення армії рф середній IQ людства підніметься приблизно на 20 одиниць.

Люди, може хтось має старі труси, чи собачі будки... Відправимо гуманітарку в росію!

Таємниця російського трикола розкрита! Спочатку росією керували Білі, потім - Червоні... А зараз Голубі!

Якщо дуже хочеться вбивати москалів але на фронті страшно, можна вбити москаля в собі...

- Підкажіть будь ласка, що на канікулах цікаве читають ваші дітки 7 років? - Статистику двохсотих орків!

Дивний народ ці москалі. Йду якось коло річки та й чую - москалик топиться і кричить: Памагітє, памагітє. Питаю: Може, Вам, добродію, допомогти? А він: Та ну, та ну. -Ото дурне.

За статистикою, кожен 300-ий росіянин не хоче воювати проти України. А кожен 200-ий чомусь навіть і не відповів.



- Русский язык однозначно богаче украинского. - Масло, олія, мастило. - Простите, что Вы сказали, можно по-русски? - Масло, масло, масло.

У конкурсі «Україна очима москалів» переміг пан Василь зі Львова, який виклав очима москалів триметрове слово «Україна»

На вулиці у Львові питають у діда: - Як краще попасти в російське консульство? Дід трохи поміркував, відповідає: - Мабуть що з гранатомета.

Смс спілкування: - ти шо робиш ? - засипаю. - Без мене засинаєш? - москаля землею засипаю!

Пане, Ви чому свою сторінку на домен «ru» поставили? - А що? - Так то ж «Раша» - москалі! - І треба ж мені такий сором ! А я думав, що «ru» - то Рідна Україна!

-Шановний,не пийте воду з цього ставка,туди лайно з всього села стікає. -Што ви гаварітє? Гаварітє па рускі,я вас нє панімаю. -Я кажу двома руками черпай!

1946 рік. Галичина. Йдуть лісом двоє хлопців. Бачуть дідусь прив‘язав москаля до дерева і пиляє пилкою. - Та чи пан не має ножа або сокири? - Та ні, пан має і ножа і сокиру, але пан має ще час і натхнення



Як вступити в вашу організацію? - Треба вбити 8 москалів і одного кота… - А кота за що? - Ви прийняті!

Мій брат працює хірургом в москві. Ріже москалів, ще й гроші отримує.

- Мені москалі нагадують глистів. - Чим саме? - Живуть, вибачайте, в дупі і цим пишаються а ще вважають, що всі їм заздрять…

-Яка різниця між москалем та цибулею? - Коли ріжеш цибулю - плачеш.

У Львові провели олімпіаду з російської мови. Переможців розстріляли...

Питаєте чому у мене такі холодні відносини до москалів? Ну ось подобаються мені холодні москалі чим вони холодніші тим краще...

Кінотеатри в росії почали нелегально показувати фільми Бетмен, Сонік 2, Капітан Америка змінивши назви фільмів на Летучая мышь, Синий ежик, Майор Росія.



- А ви знаєте, як відрізнити нормального москаля від поганого? - Як? - Нормального не видно в тепловізор.

- Чому у росії ложка використовується, як музичний інструмент? - Тому, що жерти нічого.

- Столиця росії, 6 літер, перша М ... - Мордор.

росія зробила відкриття - перші люди на землі були москалі Адам і Єва Іванови. Підтвердженням цього стало то, що жили вони дуже бідно, голі і в них було лише одне яблуко на двох.

Новий лозунг росіян: За русь - усрусь!

І тоді я вирішив стати добрим - тому що патронів на всіх не вистачить...

Юрій Гагарін все життя не пив, не курив і тренувався лише для того, щоб 108 хвилин провести не в росії.



Терміново: Бєлгородська Народна Республіка напала на Брянську Народну Республіку за історичне право користуватися абревіатурою БНР.

Скоро в росії -мужиком с руками- будуть називати не гарних майстрів, а мужиків, в яких залишилися руки.

Не кажіть каzzапам скільки в нас коштує місце на цвинтарі, бо перестануть вмирати.

Вони хотіли російську весну у Києві, а вийде українське літо у Бєлгороді.

Судячи з зовнішнього вигляду в Європу мавпячу віспу привіз лавров.

- Чому російський солдат, котрого переїхав танк, такий сумний? - Бо в нього подавленноє состояніє!

Добре, що першою людиною на Місяці був американець, а не росіянин. Бо замість прапору Америки, там би зараз стояла статуя Леніна.



Суржик, це акт згвалтування російської мови, тому не стидайтеся, розмовляйте так як вмієте!

Якщо ми даємо пі*ди другій армії світу, то хто тоді перша.

Росіяни, схоже, воюють за принципом: головне не перемога, а участь.

Зараз українська собака чи кіт без паспорту, мають більше прав у Європі ніж росіянин з паспортом!

Хочу так в старості сидіти, попивати вино і бурчати: - К@рва, знову вино скисло, все через ту кляту росію! А внуки, щоб приказували: - Діду, ти знову мариш, такої країни вже 50 років не існує!

Москалі такі смішні зі своїм «нікагда би нє падумал, што переживу чуму і вайну». Ну, хто вам сказав, що ви переживете?

Якби не було важко - не кисніть. Могло бути й гірше. Ми могли народитися москалями. Так що перехрестились та живемо далі.



Навіть космос відкликає із Челябінська свій метеорит.

Побачите десь москаля, пам’ятайте - ніякої агресії! Бийте посміхаючись!

Армія рф вже комплектує резерви танками Т-62 часів Хрущова. Далі, я так розумію, буде кавалерія...

2023р. Навіть російський ринок вирішив вийти з російського ринку.

Перелік питань, щоб визначити рашиста: - Коли ревуть воли? - Що роблять мертві бджоли? - Які в нас олені-олені? - Де найближче відділення Монобанку?

А ви помітили, що руські освободітелі розмовляють російською гірше від наших російськомовних? То нам потім прийдеться їх ще вчити крім української ще й російської мови...

У конкурсі малюнків на асфальті, перемогу здобув руський десантник, у якого не розкрився парашут



Моряки крейсера москва не потонули. Вони й надалі працюють, просто у них плаваючий графік

Міністр оборони сергій шойгу видав наказ, згідно якого заборонив служити в армії особам, які колись вживали наркотики. Настільки потужної пропаганди наркотиків в росії ще ніколи не було!

- Тут є доктор? - Так! Я! - Яка у вас спеціальність? - Я доктор математичних наук! - Тут орк помирає! - Мінус один...

- Що нового? - В росії заборонили одяг оверсайз. - Чому? - Занадто вільний.

Вчені довели, що собака, яка нюхає дупу іншого собаки, отримує більше інформації, ніж людина, яка дивиться російські новини

Валянок в росії не просто національний тип взуття. Валянок в росії - це національний тип характеру

Роскосмос заборонив росіянам літати на кораблях SpaceX Ілона Маска. Також Рогозін повідомив, що кораблі компанії Ілона Маска SpaceX, на відміну від російських, є ненадійними.



Мрію, щоб життя українців було як Євробачення. Теж без кацапів

- Вчора від нас пішов дід... - А що сталося? - Ми завели сибірського кота, а він сказав: У хаті або я, або москалі...

Китай надав росії 3000 тонн антистресових кульок в якості допомоги

Ходить москаль по лісу з кошиком - збирає гриби... Ззаду з автоматом напоготові підходить бандерівець: - Ти що тут робиш? - Гріби собіраю... Бандерівець, направляючи автомата: - А ти їх тут садив?

росіяни перестаньте говорити, що вас всі недолюблюють. Це не правда вас всі ненавидять.

Пропоную уповільнювачі руху типу Лежачий поліцейський перейменувати в Труп москаля. Скажіть, приємніше через нього буде їхати!)

- Чоловіче не збирай цих грибів, це мухомори, вони отруйні! - Что вы говорите, я не понимаю? - Очень вкусные грибы, их даже сырыми можна кушать!



Як козак шаблею блисне, москаль в штани дрисне!

- Тату, чому в зоряних війнах немає москалів? - Тому що це майбутнє, синку...

- чому москаль найкраще органічне добриво? - там 100% вміст гівна...

У москаля є дві мрії: знищити Америку і виграти туди грінкарту...

москалі: ми вєлікіє рускіє, расєя наша дєржава... Також москалі: прикидаються закордоном українцями, аби безкоштовно їздити в транспорті...

- Кукушка, кукушка, а сколько мне лет жить осталось? - Ну по-перше не кукушка, а по-друге недовго, москалику, ой недовго...

Ця гілляка на дереві сумує. Адже всі москалі дістаються Байрактарам і Джавелінам...



Настанови старого бандерівця: - Москаль завжди бреше. - А якщо не бреше? - Потикай його палкою. Імовірно, він здох.

Якщо мучить ностальгія - Чемодан, вокзал, росія!

Завжди шукав готелі в Туреччині і Греції без москалів, щоб не бити їм морди. Тепер буду шукати з москалями. Відпочинок має бути All inclusive.

- Як визначити, чи москаль бреше? - Москаль говорить? - Так - Москаль бреше.

Якось залізла коза під цапа. Ось так і зачали першого каzапа!

Основная работа чертей - убеждать население ада, что они живут в раю.

Порада для дівчат: коли не можете відкрити банку чи пляшку - уявіть, що ви моzкалю голову відкручуєте...



Вийшла килим вибити. На хвилину уявила, що то москаль. В принципі і без килима нормально)

В росії: годі пити чай із самовара, я вам електрочайник із Чорнобиля привіз...

