

Історія росії: 1157-1453 - складова частина золотої орди. 1721-1917 - імперія царів, яка свято шанувала традиції золотої орди. 1917-1991 - імперія зла. 1991-1999 - імперія алкаша. 1999-2023 - Імперія ху:::ла.

Москаль хвалиться куму. - Санек! Я був в Україні і хохлам за Донбас помстився! - Та ти шо! Як? - Я їм на Хрещатику насрав! - І шо, тебе не заарештували? - Та ні. Я акуратно. У штани.

Маленький москаль запитує свого батька: - Тато, а навіщо російському орлу дві голови? - Щоб ніхто не звертав увагу на те, яка у нас дупа, синку.

У росії інтелігент - це той, хто протирає склянку перед п’янкою.

150 років тому в росії скасували кріпосне право. Але прогрес не стоїть на місці, і тепер в росії не існує ніякого права взагалі.

- Чому в росії молоді мами змінюють памперси у своїх дітей тільки раз в тиждень? - Тому що на упаковці написано «до 4-х кг».

Ну, все як завжди у москальських казках: в тридев’ятому царстві, жила-була Царівна - Несміяна, і ніхто не міг її розсмішити. Цар, нарешті дав оголошення: Хто розсмішить мою доньку - віддам заміж і пів-царства на додачу. Черга з принців. Довго, це все тривало, поки, нарешті, не прийшов Іван-дурник і не спустив перед царівною свої штани. Довго реготала Царівна- Несміяна над Іваном, а потім гірко ридала все своє подружнє життя...



- У вас в росії стільки дурнів! - Не перебільшуйте. У нас немає дурнів, а є 94% тих хто глибоко і довічно помиляються.

- росія - спонсор тероризму? - Ні, вона - постачальник.

Найпоширеніші в росії види спорту: літрбол, фігурне хитання, синхронний сушняк.

У росії два варіанти розвитку - відкат в застій або закат у відстій ...

Приїхали росіяни до Африки. Залізли в річку, і давай кричати: - Ето наша рєка, потому что ми здєсь рускоговорящиє! А крокодилу похер було, чим обідати!

У росії усіх хвороби лікуються горілкою: від одних хвороб треба її пити, від інших - не пити, а від деяких - розтиратися.

- Куме! - Га? - Хто там у тебе верещить? - Та, москаля впіймали, вбивати будемо! - То я прийду допоможу, щоб швидше було! - Приходь, але швидше не треба! Хіба ж ми нелюди?!



Застряв росіянин у ліфті, натискає на дзвінок, йому голос: - Якщо Ви розмовляєте українською - натисніть один! Якщо Ви розмовляєте російською - натисніть два! Ну той з упевненістю натискає два, йому голос: - Шо, москалику, застряв?!

- Куме, я позавчора зранку встаю, а на моєму ставку москаль рибу ловить. Ну я його з гвинтівки ба-бах і вбив. - Добре зробили куме. - А вчора я встаю, а там уже два москалі. Ну я їх з автомата бах-бах та й убив. - Ну добре зробили куме. - А сьогодні я встаю, а весь ставок москалі обсіли і всі мою рибу ловлять. Ну я їх всіх з кулемета розстріляв. - Та ви куме брешете. - Та брешу, але як би гарно було.

Я оце думаю, що якби та акула не напала першою, то росіянець напав би сам... У неї просто не було вибору!..

Якби ви зустріли Джина і загадали б одне бажання, то: бетоном чи смолою?

- Куме, а що це за виття в дубовому гаю? - Та то росіяни гризуть кору, куме. - А чому виють? - Тому що гірка ...

Два москаля вкрали козу у старої баби та вивезли на росію. Доять перший день - 1 літр, другий день - півлітра, третій день - чверть літра. Незадоволені удоями, повели вони козу до ветеринара: - Доктор, коза молока мало дайот, не напіваємся. Ветеринар провів огляд і каже: - Козьол, конечно, задро#ний, но жить будет.

На росії всі люди діляться на два типи: ті, хто вірить путіну і ті, кому в гості стукає ФСБ.



У 2030 росія розпадеться на дві частини: р та ф

російська мова - це діалект, який виник у результаті спроб монгольської орди вивчити українську.

У всьому винні американці! Вони добре живуть і підбурюють інших жити добре. А ця ідея противна русскаму чєлавєку.

У школі. Вчителька: - Васильку, де знаходиться росія? - Мені татко не дозволяє матюкатись!

Гуцул іде полониною і веде за руку хлопчика-негра. Другий гуцул: - Іване, а хто то? - Онук. - Марійчин хлопець? - Марійчин! - А Марійка де? - Вчиться в місті. - А чого воно таке чорне? - Зате гарантія, що не москаль!

Заходить якось москаль з папугою в бар. Бармен запитує: - Де купив? Папуга відповідає: - На ринку

1946-й рік. Піймали москалі бандерівця, і проводять профілактику. - Ось тобі німець, ось тобі москаль. Кого будеш стріляти? - Та певно що москаля. Відлупцювали і знов питають. - Ось тобі німець, ось тобі москаль. Кого будеш стріляти? - Та певно що москаля. Знову били, і питають третій раз. - Кого будеш стріляти? Партизан питає комісара: - А ти кого? Комісар - Я канешно немца. Бандерівець каже: - Ти диви, мені знов москаль лишився.



- Микола, чув як москалі називають наше пиво? - Як? - Пі-іво - Повбивав би...

Іспанець Сантьяго побував в росії. Деякі речі його здивували, деякі обурили, а деякі в нього поцупили

- В росії дуже багато безглуздих речей! - Наприклад, реклама горілки...

Прийшов росіянин до мудреця, і каже: - Как открыть глаза украинскому народу, что их страна оккупирована США и катиться в пропасть? Мудрець помовчав і відповів: - Як же ви всіх за*бали, кацапи довбані!

росіяни жаліються, що їх надсилають на фронт напівготовими. Ну що ж, буде русня-аль-денте!

- Алло, це ППО росії? - Так... - У вас вчора два пропущених, із святом!

Заздрю австралійцям. Краще жити на континенті, де 21 вид смертельно отруйних змій, ніж по сусідству з руснею.



Іде дід по лісу, гриби шукає, аж тут дивиться закопаний у землю по шию хлопчина. - Ой, синку, та що ж це за нелюди таке з тобою зробили? - Дєдушка, дєдушка. Помогітє мнє. Мєня бандеровци поймалі і закопалі! Дід нагрібаючи на голову хлопчини глину: - Ой! А що ж це їм земельки то не стало?

З поганих новин: москалів дійсно дофіга. З хороших: в них так легше влучати.

У кожному правилі є винятки... Математики дозволили ділити на 0 будь-яку фразу з кремля.

Яка різниця між апельсином і росіянином? Коли апельсин знімають з дерева, то він ще живий.

В цивілізованих країнах сором і ганьбу прикривають фіговим листком, а в росії - лавровим.

- Шановний, тут палити заборонено! Хіба ви не бачите, що он на тій вивісці написано? - А що там? - питає здивовано гуцул. - «Куріть запрєщєно!» - А! Так то ж для москалів!

- Що б ти сказав, якби побачив москаля закатаного по шию і бетон? - Мало бетону.



Пливуть два українця по річці і бачать - москаль топиться і кричить: - Памагітє, help, hilfe, aiuto! І один українець другому каже: - Диви скільки він мов знає, краще б плавати навчився.

москалів ж не брали на Ноїв ковчег, як ці тварини розмножились?

- Они там на Украине котов ненавидят, говорят: Смерть катам! катам, понимаеш?! - Що за дурниці, ми обожнюємо гратися з кішками. - Они еще и с кишками играют!

На замітку кухарям: В жодному разі не думайте про москалів, коли робите відбивні. Бо получиться фарш.

Йду додому, дивлюсь - кацап телевізор тащить. Я настрашився, раптом мій! Прибігаю додому - все в порядку. Мій траву косить.

В Україні навіть від атеїста можна почути: Дякувати Богу, що я не москаль.

Яка нафіг паляниця?! Нехай вчать: цвинтар, дзвіниця, в’язниця, шибениця.



Росіяни, відступаючи з Криму, ще будуть заздрити відпливаючим з Херсону.

Орків можна дуже легко сплутати з дикою твариною: Обидва обісруться де завгодно. Їдять якусь падаль. І рідко доживають до старості.

Приходить представітєль ваєнкомата к рускай женщінє і гаваріт: - У нас для вас двє новості. Одна плахая, другая харашая. - Ну давайте сначала плахую... - Ми нашлі вашева мужа, он утанул прі пєрєправє чєрєз Днєпр. - А харашая? - Ми снялі с нєго трі вєдра раков...

Навіть не думайте падати духом. Падають окупанти і курс рускава рубля. Слава Україні!

Коли Бог створив людей, в чорта з’явилась велика заздрість і він вирішив створити теж. В нього вийшли москалі.

Потрапляє українець на суд божий, каже йому Бог: - Відправляю тебе в рай, гарне життя ти прожив. Українець щасливий але через мить опиняється в пеклі, підходить до диявола та питає: - Дияволе, а чого це я у пеклі, мені обіцяли рай. А диявол йому: - Українець? Пішли будеш росіян лупцювати.

Тим росіянам... Які тішаться що ми сидимо без світла... Знайте що наші свічки горять за Ваш упокій...



росія, напевно, єдина психіатрична лікарня, де головного лікаря вибирають самі пацієнти...

Кожен раз думаєш: Ну не можуть же вони бути аж настільки кончєними, а вони бляха можуть...

Коли журба тебе огорне і обійме печаль, бери пістоль, сідлай коня - десь є і твій москаль...

- Хана Америці! - подумав росіянин, прочитавши на обміннику: Доларів немає!

- Сьогодні дізнався про найгірший обман в моєму житті! - Який саме? - Московська ковбаса робиться не з москалів!

У країни, у якої союзники лише армія та флот, по суті, і ворога лише два: культура та освіта.

Найпопулярніші імена нового часу в РФ: Откосілантій, Ухилислав, Плоскостопій, Простантін, Усіхпослав, Чмобіліслав.



Росія - настільки потужна держава, що там навіть безпілотники з пілотами.

Завдяки мобілізації росіяни стануть першою нацією в світі, яка матиме відповідь на питання: Для чого тримати вдома пакет з пакетами!

- Не чіпай цей дріт, він під напругою! - Не понимаю укранский, можно на русском? - Говорю, крепче держи, і двумя руками!

В москві біля воєнкомату сталась бійка двох груп співробітників, які намагались вручити один одному повістки.

росіянин розмовляє з українцем: - А це правда, що у вас в Україні борщ їдять? - Так, а що? - А у нас у росії цю гидоту тільки худобі дають. Українець, почухавши потилицю, запитує у росіянина: - А це правда, що у вас у росії щі їдять? - Так, а що? - А у нас в Україні цю гидоту навіть худоба не їсть.

Кожен раз коли відключають світло пам’ятай, що вже 63800 москалів залишились без світла назавжди.

Московити написали про зупинку гарячого водопостачання у Львові. Половина кацапів запитує: Що таке гаряча вода? Інша половина: Що таке водопостачання?



Удар нашої помсти - палає спиртзавод в Курської області! Бо ми точно знаємо, де в русні справжні центри ухвалення рішень!

- Як називаються російські солдати після зустрічі з Байрактаром? - Затуркані!

Якщо на вашу кухню заповзли сусідські таргани - це не означає, що кухня належить їм. Навіть якщо вони провели там референдум)

В дитинстві завжди хотів дізнатися, що було в російській казці далі, після того, як Іван-дурень став царем. Дізнався...

Скоро всі банки росії об’єднаються в один банк - об’єднаний банк - ОБ’ЄБАНК або національний єдиний банк - НАЄБАНК.

150 років тому у росії скасували право на володіння рабами. Але прогрес не стоїть на місці, і тепер у росії не існує жодного права взагалі.

Мобілізованих російських пілотів просять приходити зі своїми літаками.



Кацап в сільському туалеті роняє 100 рублів. - Чьорт вазьмі, сто рублєй в гавно ураніл. Ну не палєзу же я за сотнєй туда. Витягує з гаманця ще 1000 рублів і кидає до сотні. - А вот за тищусто можно і залєзть.

Москалі п’ють в забігайлівці бояришник і мріють про національну велич: - Ех, якби не ці прокляті американці, які придумали телефони, туалети, холодильники, інтернет, то ми би з вами жили!..

росіяни - це перша в історії народність, яка тікає зі своєї країни не тому, що на них напали, а тому, що вони напали.

Пропоную оголосити для росіян, що з 1 листопада здача в полон буде платною. Здайся до цієї дати і отримай два місяці полону безкоштовно. Передплату на полон можна оформити, ще перебуваючи в росії.

- Давайте скинемо на парашутах бочки зі спиртом на позиції мобілізованих росіян. Тоді їх за кілька годин можна як гриби збирати! - Хм. Але якщо скинути метиловий спирт, то потім можна і не збирати.

- Пане шойгу, чому у мобілізаційних списках немає дітей членів уряду та депутатів держдуми? - Ви що - указ не читали? Мобілізація стосується лише громадян російської федерації.

Застряг росіянин у ліфті, натискає на дзвінок, йому голос: - Якщо Ви розмовляєте українською - натисніть один! Якщо Ви розмовляєте російською - натисніть два! Ну той з упевненістю натискає два, йому голос: - Шо, москалику, застряг?!



Нове гасло росії - Мій дід воював і помер за те, щоб я воював і помер...

Фраза: Та кому ти потрібна з чотирма дітьми? у росії заграла іншими фарбами.

Власник турів до Монголії з росії за лічені дні перетворився на мільярдера...

Після вибуху газопроводу Газпром став найбільшим у світі виробником газованої води...

Я правильно розумію, що резервна армія росії не цікавиться куди ділась регулярна?

Група російських вчених нещодавно з’ясувала, що вони взагалі не вчені, а пацієнти психіатричної лікарні...

Бандерівці знущаються над полоненими... Примушують мити ноги, чистити зуби, ср***ти в унітаз.



Залізнична катастрофа. З рейок зійшов спецпотяг із москалями. Рятувальники, які прибули на місце трагедії, виявили, що місцеві мешканці встигли похоронити всіх. - Що, геть усі загинули? - Ну, декотрі, правда, намагались переконати нас, що живі, та ж ви знаєте цих москалів - вони завжди брешуть.

Підходить рогозін до Ілона Маска і каже: - Маск, поясни, що таке нюанс. Маск купує Твіттер і каже: - От дивись у тебе є Твіттер і в мене, але є один нюанс.

- Чим схожі типовий росіянин і типовий американець? - Обидвоє весь час думають про проблеми США, і ніколи не згадують про проблеми росії.

- Що то за виття на болотах, Ватсоне? - Мобілізація, сер.

- Куме, що то є: частичная мобилизация? - Це, типу, додому рашисти будуть Частично в пакетах повертатися!

- Що б ти сказав, якби побачив росіянина закатаного по шию в бетон? - Мало бетону.

ЧМО - Частково Мобілізований Орк.



- Як назвати мобілізацію на росії? - Орк енд тревел.

- В чому різниця між українцями і росіянами? - Нас мало, але ми зграя. - А росіяни? - Їх багато, але вони стадо.

Зустрічаються два галицькі інтелігенти: - Ти знаєш, що таке стриптиз по-москальськи? - Що? - Це коли під пісню Ой мороз, мороз знімають шкуру з п’яного ведмедя.

Японець, москаль і українець їдуть в поїзді. Тут японець дістає найновіший смартфон раптом раз, і у вікно викинув... Всі так: - О! Ти шо, така штука, а ти її... Японець: - Так у нас повно такого! Москаль дістає ящик горілки, хоп і все у вікно! Всі такі: - Ти шо, така штука... Москаль: - Так у нас цього добра повно! Українець хоп - москаля у вікно... - У нас цього добра до чортиків лазить...

Загадка: Кругле, лежить на Херсонщині, в середині кісточки? -Голова російського солдата!

- Ти чув, росіяни оживили Бандеру? - Так, тепер нам треба оживити Кутузова. - А то для чого? - Хай іще раз москву спалить!

Їде потяг Львів-Київ. І раптом машиніст побачив, що на колії сидить москаль. Потяг зходить з рейок, їде через ліс, долину, поле кукурудзи, виїжджає на колію і їде далі. До машиніста заходить провідниця і питає: - Що то було? Машиніст відповідає: - То москаль на колії сидів. - Так треба було давити. - Та в кукурудзі тільки наздогнав.



Українці в Іспанії: - Кориду бачив? - Бачив. Бугай кацапа затоптав. - Які ж кацапи в Іспанії? - А який недоумок, крім кацапа, попре на бугая з червоним прапором?

